
############## mia - 07/24/20 23:54:47 EDT -0400 ##############

2020-07-25 05:43:57 350 packets transmitted, 350 received, 0% packet loss, time 20949532ms
2020-07-25 05:43:57 rtt min/avg/max/mdev = 37.210/53.008/120.538/10.022 ms

############## mia - 07/25/20 05:54:46 EDT -0400 ##############

2020-07-25 11:43:55 350 packets transmitted, 350 received, 0% packet loss, time 20949168ms
2020-07-25 11:43:55 rtt min/avg/max/mdev = 38.417/72.939/1464.291/89.829 ms

############## mia - 07/25/20 11:54:44 EDT -0400 ##############

2020-07-25 17:43:54 350 packets transmitted, 350 received, 0% packet loss, time 20949387ms
2020-07-25 17:43:54 rtt min/avg/max/mdev = 37.102/104.838/1659.923/143.449 ms

############## mia - 07/25/20 17:54:45 EDT -0400 ##############

2020-07-25 22:43:53 350 packets transmitted, 350 received, 0% packet loss, time 20948639ms
2020-07-25 22:43:53 rtt min/avg/max/mdev = 38.619/87.983/4012.924/226.687 ms

############## mia - 07/25/20 23:54:46 EST -0500 ##############

2020-07-26 05:43:56 350 packets transmitted, 350 received, 0% packet loss, time 20949680ms
2020-07-26 05:43:56 rtt min/avg/max/mdev = 31.453/48.948/92.304/7.813 ms

############## mia - 07/26/20 05:54:46 EST -0500 ##############

2020-07-26 11:43:55 350 packets transmitted, 350 received, 0% packet loss, time 20949056ms
2020-07-26 11:43:55 rtt min/avg/max/mdev = 36.742/106.351/4414.310/302.456 ms

############## mia - 07/27/20 11:54:44 EST -0500 ##############

2020-07-27 17:43:53 350 packets transmitted, 350 received, 0% packet loss, time 20948844ms
2020-07-27 17:43:53 rtt min/avg/max/mdev = 38.995/103.251/2158.176/200.204 ms

############## mia - 07/27/20 17:54:45 EST -0500 ##############

2020-07-27 23:44:55 350 packets transmitted, 349 received, 0% packet loss, time 20950480ms
2020-07-27 23:44:55 rtt min/avg/max/mdev = 39.854/117.381/4240.952/327.357 ms

############## mia - 07/27/20 23:54:49 EST -0500 ##############

2020-07-28 05:43:57 350 packets transmitted, 350 received, 0% packet loss, time 20948284ms
2020-07-28 05:43:57 rtt min/avg/max/mdev = 35.945/55.926/525.819/33.407 ms

############## mia - 07/28/20 05:54:47 EST -0500 ##############

2020-07-28 11:44:55 350 packets transmitted, 343 received, 2% packet loss, time 20948198ms
2020-07-28 11:44:55 rtt min/avg/max/mdev = 36.612/160.544/7750.149/619.816 ms

############## mia - 07/28/20 11:54:47 EST -0500 ##############

2020-07-28 17:43:56 350 packets transmitted, 350 received, 0% packet loss, time 20948549ms
2020-07-28 17:43:56 rtt min/avg/max/mdev = 38.481/119.906/2547.876/291.819 ms

############## mia - 07/28/20 17:54:46 EST -0500 ##############

2020-07-28 23:43:54 350 packets transmitted, 350 received, 0% packet loss, time 20948758ms
2020-07-28 23:43:54 rtt min/avg/max/mdev = 37.932/75.213/889.997/78.609 ms

############## mia - 07/28/20 23:54:43 EST -0500 ##############

2020-07-29 05:43:52 350 packets transmitted, 350 received, 0% packet loss, time 20948826ms
2020-07-29 05:43:52 rtt min/avg/max/mdev = 34.141/51.136/367.982/21.771 ms

############## mia - 07/29/20 05:54:45 EST -0500 ##############

2020-07-29 11:44:55 350 packets transmitted, 349 received, 0% packet loss, time 20949529ms
2020-07-29 11:44:55 rtt min/avg/max/mdev = 33.030/78.892/1245.797/93.158 ms

############## mia - 07/29/20 11:54:48 EST -0500 ##############

2020-07-29 17:44:58 350 packets transmitted, 347 received, 0% packet loss, time 20949950ms
2020-07-29 17:44:58 rtt min/avg/max/mdev = 35.272/125.365/4989.734/347.431 ms

############## mia - 07/29/20 17:54:44 EST -0500 ##############

2020-07-29 23:43:55 350 packets transmitted, 350 received, 0% packet loss, time 20950064ms
2020-07-29 23:43:55 rtt min/avg/max/mdev = 38.696/66.829/327.484/29.799 ms

############## mia - 07/29/20 23:54:45 EST -0500 ##############

2020-07-30 05:43:54 350 packets transmitted, 350 received, 0% packet loss, time 20949227ms
2020-07-30 05:43:54 rtt min/avg/max/mdev = 35.683/57.112/460.934/38.517 ms

############## mia - 07/30/20 05:54:44 EST -0500 ##############

2020-07-30 11:44:54 350 packets transmitted, 349 received, 0% packet loss, time 20950001ms
2020-07-30 11:44:54 rtt min/avg/max/mdev = 37.680/93.946/3743.274/221.039 ms

############## mia - 07/30/20 11:54:45 EST -0500 ##############

2020-07-30 17:43:54 350 packets transmitted, 350 received, 0% packet loss, time 20948667ms
2020-07-30 17:43:54 rtt min/avg/max/mdev = 37.007/59.135/372.479/24.426 ms

############## mia - 07/30/20 17:54:47 EST -0500 ##############

2020-07-30 23:43:56 350 packets transmitted, 350 received, 0% packet loss, time 20949012ms
2020-07-30 23:43:56 rtt min/avg/max/mdev = 38.411/61.443/259.651/19.729 ms

############## mia - 07/30/20 23:54:45 EST -0500 ##############

2020-07-31 05:44:55 350 packets transmitted, 349 received, 0% packet loss, time 20949760ms
2020-07-31 05:44:55 rtt min/avg/max/mdev = 36.269/52.083/121.496/8.864 ms

############## mia - 07/31/20 05:54:45 EST -0500 ##############

2020-07-31 11:46:43 350 packets transmitted, 289 received, 17% packet loss, time 20969481ms
2020-07-31 11:46:43 rtt min/avg/max/mdev = 38.721/901.905/74330.905/6101.926 ms, pipe 2

############## mia - 07/31/20 17:54:43 EST -0500 ##############

2020-07-31 23:43:53 350 packets transmitted, 350 received, 0% packet loss, time 20949199ms
2020-07-31 23:43:53 rtt min/avg/max/mdev = 41.118/90.039/3153.835/173.022 ms

############## mia - 07/31/20 23:54:46 EST -0500 ##############

2020-08-01 05:43:56 350 packets transmitted, 350 received, 0% packet loss, time 20949977ms
2020-08-01 05:43:56 rtt min/avg/max/mdev = 35.312/57.062/222.288/17.649 ms

############## mia - 08/01/20 05:54:45 EST -0500 ##############

2020-08-01 11:44:54 350 packets transmitted, 349 received, 0% packet loss, time 20948602ms
2020-08-01 11:44:54 rtt min/avg/max/mdev = 38.826/120.771/5058.417/349.143 ms

############## mia - 08/01/20 11:54:33 EST -0500 ##############

2020-08-01 17:44:46 350 packets transmitted, 345 received, 1% packet loss, time 20952955ms
2020-08-01 17:44:46 rtt min/avg/max/mdev = 41.297/149.426/11283.794/644.132 ms

############## mia - 08/01/20 17:54:47 EST -0500 ##############

2020-08-01 23:43:56 350 packets transmitted, 350 received, 0% packet loss, time 20948393ms
2020-08-01 23:43:56 rtt min/avg/max/mdev = 37.124/77.898/2504.085/141.237 ms

############## mia - 08/01/20 23:54:48 EST -0500 ##############

2020-08-02 05:43:57 350 packets transmitted, 350 received, 0% packet loss, time 20949438ms
2020-08-02 05:43:57 rtt min/avg/max/mdev = 37.827/56.389/1584.863/82.111 ms

############## mia - 08/02/20 05:54:47 EST -0500 ##############

2020-08-02 11:44:57 350 packets transmitted, 347 received, 0% packet loss, time 20949414ms
2020-08-02 11:44:57 rtt min/avg/max/mdev = 39.503/133.751/6870.875/491.948 ms

############## mia - 08/02/20 11:54:35 EST -0500 ##############

2020-08-02 17:44:44 350 packets transmitted, 349 received, 0% packet loss, time 20948762ms
2020-08-02 17:44:44 rtt min/avg/max/mdev = 38.462/90.516/1063.666/102.323 ms

############## mia - 08/02/20 17:54:46 EST -0500 ##############

2020-08-02 23:44:56 350 packets transmitted, 349 received, 0% packet loss, time 20950249ms
2020-08-02 23:44:56 rtt min/avg/max/mdev = 39.749/76.541/1944.297/112.874 ms

############## mia - 08/02/20 23:54:45 EST -0500 ##############

2020-08-03 05:43:55 350 packets transmitted, 350 received, 0% packet loss, time 20949645ms
2020-08-03 05:43:55 rtt min/avg/max/mdev = 38.262/60.985/482.708/31.698 ms

############## mia - 08/03/20 05:54:46 EST -0500 ##############

2020-08-03 11:44:56 350 packets transmitted, 337 received, 3% packet loss, time 20949223ms
2020-08-03 11:44:56 rtt min/avg/max/mdev = 41.259/256.439/15092.893/1064.875 ms

############## mia - 08/03/20 11:54:35 EST -0500 ##############

2020-08-03 17:44:44 350 packets transmitted, 349 received, 0% packet loss, time 20948920ms
2020-08-03 17:44:44 rtt min/avg/max/mdev = 38.382/109.350/1777.507/175.968 ms

############## mia - 08/03/20 23:54:47 EST -0500 ##############

2020-08-04 05:43:56 350 packets transmitted, 350 received, 0% packet loss, time 20948995ms
2020-08-04 05:43:56 rtt min/avg/max/mdev = 38.013/58.092/511.569/34.127 ms

############## mia - 08/04/20 11:54:39 EST -0500 ##############

2020-08-04 17:44:53 350 packets transmitted, 343 received, 2% packet loss, time 20953344ms
2020-08-04 17:44:53 rtt min/avg/max/mdev = 39.490/141.898/8727.084/512.423 ms

############## mia - 08/04/20 23:54:46 EST -0500 ##############

2020-08-05 05:43:55 350 packets transmitted, 350 received, 0% packet loss, time 20949592ms
2020-08-05 05:43:55 rtt min/avg/max/mdev = 39.027/53.627/380.020/22.523 ms

############## mia - 08/05/20 11:54:38 EST -0500 ##############

2020-08-05 17:44:48 350 packets transmitted, 348 received, 0% packet loss, time 20950011ms
2020-08-05 17:44:48 rtt min/avg/max/mdev = 40.798/107.650/8558.981/467.173 ms

############## mia - 08/05/20 23:54:45 EST -0500 ##############

2020-08-06 05:43:55 350 packets transmitted, 350 received, 0% packet loss, time 20949538ms
2020-08-06 05:43:55 rtt min/avg/max/mdev = 39.466/64.995/380.207/30.283 ms

############## mia - 08/06/20 11:54:39 EST -0500 ##############

2020-08-06 17:44:49 350 packets transmitted, 348 received, 0% packet loss, time 20949275ms
2020-08-06 17:44:49 rtt min/avg/max/mdev = 43.126/209.639/3906.243/407.893 ms

############## mia - 08/06/20 23:54:45 EST -0500 ##############

2020-08-07 05:44:55 350 packets transmitted, 349 received, 0% packet loss, time 20949200ms
2020-08-07 05:44:55 rtt min/avg/max/mdev = 33.729/63.599/259.582/21.285 ms

############## mia - 08/07/20 11:54:40 EST -0500 ##############

############## mia - 08/07/20 11:54:40 EST -0500 ##############


############## mia - 08/07/20 23:54:48 EST -0500 ##############

2020-08-08 05:43:57 350 packets transmitted, 350 received, 0% packet loss, time 20948898ms
2020-08-08 05:43:57 rtt min/avg/max/mdev = 34.063/51.537/124.971/10.824 ms

############## mia - 08/08/20 11:54:43 EST -0500 ##############

2020-08-08 17:44:53 350 packets transmitted, 349 received, 0% packet loss, time 20949882ms
2020-08-08 17:44:53 rtt min/avg/max/mdev = 33.911/96.235/1316.430/115.335 ms

############## mia - 08/08/20 23:54:43 EST -0500 ##############

2020-08-09 05:43:53 350 packets transmitted, 350 received, 0% packet loss, time 20949937ms
2020-08-09 05:43:53 rtt min/avg/max/mdev = 33.995/49.354/550.449/27.831 ms

############## mia - 08/09/20 11:54:42 EST -0500 ##############

2020-08-09 17:43:50 350 packets transmitted, 350 received, 0% packet loss, time 20948284ms
2020-08-09 17:43:50 rtt min/avg/max/mdev = 42.671/115.765/1641.971/109.675 ms

############## mia - 08/09/20 23:54:44 EST -0500 ##############

2020-08-10 05:43:54 350 packets transmitted, 350 received, 0% packet loss, time 20949376ms
2020-08-10 05:43:54 rtt min/avg/max/mdev = 30.481/49.116/235.984/13.544 ms

############## mia - 08/10/20 11:54:44 EST -0500 ##############

2020-08-10 17:43:53 350 packets transmitted, 350 received, 0% packet loss, time 20948814ms
2020-08-10 17:43:53 rtt min/avg/max/mdev = 37.769/74.834/588.872/55.267 ms

############## mia - 08/10/20 23:54:45 EST -0500 ##############

2020-08-11 05:43:53 350 packets transmitted, 350 received, 0% packet loss, time 20948106ms
2020-08-11 05:43:53 rtt min/avg/max/mdev = 36.073/50.755/339.415/21.177 ms

############## mia - 08/11/20 11:54:49 EST -0500 ##############

2020-08-11 17:43:58 350 packets transmitted, 350 received, 0% packet loss, time 20948740ms
2020-08-11 17:43:58 rtt min/avg/max/mdev = 41.651/100.218/1186.253/86.410 ms

############## mia - 08/11/20 23:54:45 EST -0500 ##############

2020-08-12 05:43:54 350 packets transmitted, 350 received, 0% packet loss, time 20949088ms
2020-08-12 05:43:54 rtt min/avg/max/mdev = 31.241/52.867/371.616/19.371 ms

############## mia - 08/12/20 11:54:44 EST -0500 ##############

2020-08-12 17:44:55 350 packets transmitted, 325 received, 7% packet loss, time 20950819ms
2020-08-12 17:44:55 rtt min/avg/max/mdev = 39.570/126.658/8520.788/486.661 ms

############## mia - 08/12/20 23:54:49 EST -0500 ##############

2020-08-13 05:43:57 350 packets transmitted, 350 received, 0% packet loss, time 20947973ms
2020-08-13 05:43:57 rtt min/avg/max/mdev = 36.672/53.747/107.243/9.851 ms

############## mia - 08/13/20 15:27:15 EST -0500 ##############

2020-08-13 21:23:20 350 packets transmitted, 250 received, 28% packet loss, time 20998184ms
2020-08-13 21:23:20 rtt min/avg/max/mdev = 42.912/4907.805/183164.774/23455.403 ms, pipe 3

############## mia - 08/13/20 23:54:50 EST -0500 ##############

2020-08-14 05:51:21 350 packets transmitted, 215 received, 38% packet loss, time 21031502ms
2020-08-14 05:51:21 rtt min/avg/max/mdev = 48.627/16399.162/179634.288/35719.067 ms, pipe 3

############## mia - 08/14/20 11:54:47 EST -0500 ##############

2020-08-14 17:50:29 350 packets transmitted, 245 received, 30% packet loss, time 21003909ms
2020-08-14 17:50:29 rtt min/avg/max/mdev = 52.374/6034.889/168376.401/25573.079 ms, pipe 3

############## mia - 08/14/20 23:54:50 EST -0500 ##############

2020-08-15 05:49:26 350 packets transmitted, 290 received, 17% packet loss, time 20979420ms
2020-08-15 05:49:26 rtt min/avg/max/mdev = 47.109/2295.918/148327.181/14776.041 ms, pipe 3

############## mia - 08/15/20 11:54:47 EST -0500 ##############

2020-08-15 17:43:56 350 packets transmitted, 350 received, 0% packet loss, time 20949420ms
2020-08-15 17:43:56 rtt min/avg/max/mdev = 48.595/128.256/8586.743/501.878 ms

############## mia - 08/17/20 00:00:53 EST -0500 ##############

############## mia - 08/17/20 00:00:53 EST -0500 ##############


############## mia - 08/17/20 23:55:45 EST -0500 ##############

2020-08-18 11:36:05 700 packets transmitted, 697 received, 0% packet loss, time 41960376ms
2020-08-18 11:36:05 rtt min/avg/max/mdev = 37.773/59.633/430.670/19.820 ms

############## mia - 08/18/20 11:55:48 EST -0500 ##############

2020-08-18 23:35:07 700 packets transmitted, 700 received, 0% packet loss, time 41958553ms
2020-08-18 23:35:07 rtt min/avg/max/mdev = 43.136/73.699/953.080/48.008 ms

############## mia - 08/18/20 23:55:47 EST -0500 ##############

2020-08-19 11:35:04 700 packets transmitted, 700 received, 0% packet loss, time 41956524ms
2020-08-19 11:35:04 rtt min/avg/max/mdev = 36.357/61.966/489.638/33.773 ms

############## mia - 08/19/20 11:55:52 EST -0500 ##############

2020-08-19 23:35:09 700 packets transmitted, 700 received, 0% packet loss, time 41957207ms
2020-08-19 23:35:09 rtt min/avg/max/mdev = 41.562/75.149/385.731/33.114 ms

############## mia - 08/19/20 23:55:46 EST -0500 ##############

2020-08-20 11:35:05 700 packets transmitted, 700 received, 0% packet loss, time 41958213ms
2020-08-20 11:35:05 rtt min/avg/max/mdev = 41.142/66.861/693.031/37.663 ms

############## mia - 08/20/20 11:55:52 EST -0500 ##############

2020-08-20 23:35:09 700 packets transmitted, 700 received, 0% packet loss, time 41957423ms
2020-08-20 23:35:09 rtt min/avg/max/mdev = 36.433/62.117/462.106/23.835 ms

############## mia - 08/20/20 23:55:45 EST -0500 ##############

2020-08-21 11:35:03 700 packets transmitted, 700 received, 0% packet loss, time 41957899ms
2020-08-21 11:35:03 rtt min/avg/max/mdev = 41.083/67.382/523.521/35.404 ms

############## mia - 08/21/20 11:55:53 EST -0500 ##############

2020-08-21 23:35:10 700 packets transmitted, 700 received, 0% packet loss, time 41956680ms
2020-08-21 23:35:10 rtt min/avg/max/mdev = 34.487/62.932/278.480/23.222 ms

############## mia - 08/21/20 23:55:44 EST -0500 ##############

2020-08-22 11:35:02 700 packets transmitted, 700 received, 0% packet loss, time 41957753ms
2020-08-22 11:35:02 rtt min/avg/max/mdev = 35.396/63.656/1267.205/50.032 ms

############## mia - 08/22/20 11:55:54 EST -0500 ##############

2020-08-22 23:35:12 700 packets transmitted, 700 received, 0% packet loss, time 41958273ms
2020-08-22 23:35:12 rtt min/avg/max/mdev = 32.254/66.467/484.277/37.157 ms

############## mia - 08/22/20 23:55:47 EST -0500 ##############

2020-08-23 11:36:05 700 packets transmitted, 696 received, 0% packet loss, time 41958100ms
2020-08-23 11:36:05 rtt min/avg/max/mdev = 33.311/63.613/624.125/39.436 ms

############## mia - 08/23/20 11:55:57 EST -0500 ##############

2020-08-23 23:35:15 700 packets transmitted, 700 received, 0% packet loss, time 41957857ms
2020-08-23 23:35:15 rtt min/avg/max/mdev = 40.306/65.280/366.118/27.316 ms

############## mia - 08/25/20 00:20:56 EST -0500 ##############

2020-08-25 12:01:13 700 packets transmitted, 685 received, 2% packet loss, time 41956999ms
2020-08-25 12:01:13 rtt min/avg/max/mdev = 32.981/62.747/686.345/47.738 ms

############## mia - 08/25/20 12:15:47 EST -0500 ##############

2020-08-25 23:56:11 700 packets transmitted, 686 received, 2% packet loss, time 41963521ms
2020-08-25 23:56:11 rtt min/avg/max/mdev = 35.914/95.494/2174.078/167.496 ms

############## mia - 08/26/20 00:20:57 EST -0500 ##############

2020-08-26 12:01:25 700 packets transmitted, 671 received, 4% packet loss, time 41967896ms
2020-08-26 12:01:25 rtt min/avg/max/mdev = 33.046/68.816/2548.298/120.187 ms

############## mia - 08/27/20 00:21:01 EST -0500 ##############

2020-08-27 12:01:30 700 packets transmitted, 699 received, 0% packet loss, time 41968938ms
2020-08-27 12:01:30 rtt min/avg/max/mdev = 31.818/50.930/341.954/16.157 ms

############## mia - 08/27/20 12:15:42 EST -0500 ##############

2020-08-27 23:56:12 700 packets transmitted, 684 received, 2% packet loss, time 41969592ms
2020-08-27 23:56:12 rtt min/avg/max/mdev = 34.728/57.194/470.944/27.983 ms

############## mia - 08/28/20 00:21:01 EST -0500 ##############

2020-08-28 12:01:28 700 packets transmitted, 699 received, 0% packet loss, time 41966478ms
2020-08-28 12:01:28 rtt min/avg/max/mdev = 31.197/52.218/597.437/31.954 ms

############## mia - 08/28/20 12:15:41 EST -0500 ##############

2020-08-28 23:56:06 700 packets transmitted, 699 received, 0% packet loss, time 41964664ms
2020-08-28 23:56:06 rtt min/avg/max/mdev = 35.394/65.006/1044.160/52.365 ms

############## mia - 08/29/20 00:21:04 EST -0500 ##############

2020-08-29 12:00:30 700 packets transmitted, 700 received, 0% packet loss, time 41965962ms
2020-08-29 12:00:30 rtt min/avg/max/mdev = 32.995/57.769/1505.609/60.208 ms

############## mia - 08/29/20 12:15:44 EST -0500 ##############

2020-08-29 23:56:14 700 packets transmitted, 699 received, 0% packet loss, time 41969762ms
2020-08-29 23:56:14 rtt min/avg/max/mdev = 35.497/71.024/3492.469/159.563 ms

############## mia - 08/30/20 00:21:00 EST -0500 ##############

2020-08-30 12:01:26 700 packets transmitted, 699 received, 0% packet loss, time 41966288ms
2020-08-30 12:01:26 rtt min/avg/max/mdev = 30.945/51.490/268.866/16.454 ms

############## mia - 08/30/20 12:15:42 EST -0500 ##############

2020-08-30 23:56:11 700 packets transmitted, 695 received, 0% packet loss, time 41968740ms
2020-08-30 23:56:11 rtt min/avg/max/mdev = 35.502/82.192/1780.634/113.797 ms

############## mia - 08/31/20 00:21:01 EST -0500 ##############

2020-08-31 12:01:26 700 packets transmitted, 698 received, 0% packet loss, time 41964709ms
2020-08-31 12:01:26 rtt min/avg/max/mdev = 33.390/50.897/372.934/19.477 ms

############## mia - 08/31/20 12:15:43 EST -0500 ##############

2020-08-31 23:56:08 700 packets transmitted, 698 received, 0% packet loss, time 41964633ms
2020-08-31 23:56:08 rtt min/avg/max/mdev = 35.246/62.282/1333.223/64.896 ms

############## mia - 09/01/20 00:21:03 EST -0500 ##############

2020-09-01 12:01:32 700 packets transmitted, 699 received, 0% packet loss, time 41968831ms
2020-09-01 12:01:32 rtt min/avg/max/mdev = 32.124/55.841/2614.692/98.207 ms

############## mia - 09/01/20 12:15:43 EST -0500 ##############

2020-09-01 23:55:10 700 packets transmitted, 700 received, 0% packet loss, time 41967069ms
2020-09-01 23:55:10 rtt min/avg/max/mdev = 36.795/94.074/1652.364/142.611 ms

############## mia - 09/02/20 00:21:02 EST -0500 ##############

2020-09-02 12:01:28 700 packets transmitted, 697 received, 0% packet loss, time 41965741ms
2020-09-02 12:01:28 rtt min/avg/max/mdev = 31.882/81.438/2062.746/134.283 ms

############## mia - 09/02/20 12:15:42 EST -0500 ##############

2020-09-02 23:55:08 700 packets transmitted, 700 received, 0% packet loss, time 41965782ms
2020-09-02 23:55:08 rtt min/avg/max/mdev = 34.534/64.992/1392.226/65.543 ms

############## mia - 09/03/20 00:21:05 EST -0500 ##############

2020-09-03 12:00:24 700 packets transmitted, 700 received, 0% packet loss, time 41958233ms
2020-09-03 12:00:24 rtt min/avg/max/mdev = 28.333/50.266/1011.252/40.741 ms

############## mia - 09/03/20 12:15:43 EST -0500 ##############

2020-09-03 23:55:11 700 packets transmitted, 700 received, 0% packet loss, time 41967535ms
2020-09-03 23:55:11 rtt min/avg/max/mdev = 30.088/61.075/1847.307/73.451 ms

############## mia - 09/04/20 00:21:06 EST -0500 ##############

2020-09-04 12:01:32 700 packets transmitted, 699 received, 0% packet loss, time 41965629ms
2020-09-04 12:01:32 rtt min/avg/max/mdev = 29.708/50.464/315.881/18.903 ms

############## mia - 09/05/20 00:21:07 EST -0500 ##############

2020-09-05 12:01:36 700 packets transmitted, 699 received, 0% packet loss, time 41969658ms
2020-09-05 12:01:36 rtt min/avg/max/mdev = 30.871/52.754/1881.800/71.891 ms

############## mia - 09/05/20 12:15:40 EST -0500 ##############

2020-09-05 23:56:04 700 packets transmitted, 699 received, 0% packet loss, time 41963317ms
2020-09-05 23:56:04 rtt min/avg/max/mdev = 27.806/72.144/1676.859/82.708 ms

############## mia - 09/06/20 00:21:10 EST -0500 ##############

2020-09-06 12:00:38 700 packets transmitted, 700 received, 0% packet loss, time 41968414ms
2020-09-06 12:00:38 rtt min/avg/max/mdev = 28.594/47.079/455.248/19.839 ms

############## mia - 09/06/20 12:15:44 EST -0500 ##############

2020-09-06 23:56:12 700 packets transmitted, 698 received, 0% packet loss, time 41968394ms
2020-09-06 23:56:12 rtt min/avg/max/mdev = 28.587/78.506/5312.615/215.203 ms

############## mia - 09/07/20 00:21:07 EST -0500 ##############

2020-09-07 12:01:36 700 packets transmitted, 698 received, 0% packet loss, time 41968820ms
2020-09-07 12:01:36 rtt min/avg/max/mdev = 28.938/52.970/494.147/37.587 ms

############## mia - 09/07/20 12:15:43 EST -0500 ##############

2020-09-07 23:56:14 700 packets transmitted, 698 received, 0% packet loss, time 41970870ms
2020-09-07 23:56:14 rtt min/avg/max/mdev = 28.860/69.581/799.723/59.796 ms

############## mia - 09/08/20 00:21:09 EST -0500 ##############

2020-09-08 12:01:36 700 packets transmitted, 698 received, 0% packet loss, time 41966776ms
2020-09-08 12:01:36 rtt min/avg/max/mdev = 31.198/98.069/1985.284/125.581 ms

############## mia - 09/08/20 12:15:44 EST -0500 ##############

2020-09-08 23:56:13 700 packets transmitted, 699 received, 0% packet loss, time 41968920ms
2020-09-08 23:56:13 rtt min/avg/max/mdev = 32.219/80.038/1334.963/68.507 ms

############## mia - 09/09/20 00:21:11 EST -0500 ##############

2020-09-09 12:01:40 700 packets transmitted, 699 received, 0% packet loss, time 41969475ms
2020-09-09 12:01:40 rtt min/avg/max/mdev = 29.331/91.385/432.266/54.477 ms

############## mia - 09/09/20 12:15:40 EST -0500 ##############

2020-09-09 23:56:09 700 packets transmitted, 690 received, 1% packet loss, time 41968835ms
2020-09-09 23:56:09 rtt min/avg/max/mdev = 34.523/202.887/15632.018/874.876 ms

############## mia - 09/10/20 00:21:12 EST -0500 ##############

2020-09-10 12:00:36 700 packets transmitted, 700 received, 0% packet loss, time 41964443ms
2020-09-10 12:00:36 rtt min/avg/max/mdev = 35.388/59.649/471.812/33.885 ms

############## mia - 09/10/20 12:15:40 EST -0500 ##############

2020-09-10 23:55:08 700 packets transmitted, 700 received, 0% packet loss, time 41967723ms
2020-09-10 23:55:08 rtt min/avg/max/mdev = 30.524/97.610/4532.678/225.064 ms

############## mia - 09/11/20 00:21:14 EST -0500 ##############

2020-09-11 12:01:40 700 packets transmitted, 699 received, 0% packet loss, time 41966184ms
2020-09-11 12:01:40 rtt min/avg/max/mdev = 33.225/69.666/2023.900/85.675 ms

############## mia - 09/11/20 12:15:43 EST -0500 ##############

2020-09-11 23:56:12 700 packets transmitted, 699 received, 0% packet loss, time 41968970ms
2020-09-11 23:56:12 rtt min/avg/max/mdev = 35.187/100.315/11901.232/458.766 ms

############## mia - 09/12/20 00:21:15 EST -0500 ##############

2020-09-12 12:01:41 700 packets transmitted, 699 received, 0% packet loss, time 41965373ms
2020-09-12 12:01:41 rtt min/avg/max/mdev = 28.444/66.055/5988.400/230.020 ms

############## mia - 09/12/20 12:15:43 EST -0500 ##############

2020-09-12 23:55:07 700 packets transmitted, 700 received, 0% packet loss, time 41963681ms
2020-09-12 23:55:07 rtt min/avg/max/mdev = 32.794/112.895/9101.798/473.702 ms

############## mia - 09/13/20 00:21:13 EST -0500 ##############

2020-09-13 12:01:38 700 packets transmitted, 699 received, 0% packet loss, time 41964562ms
2020-09-13 12:01:38 rtt min/avg/max/mdev = 29.376/65.459/1411.620/91.728 ms

############## mia - 09/13/20 12:15:45 EST -0500 ##############

2020-09-13 23:56:09 700 packets transmitted, 699 received, 0% packet loss, time 41964678ms
2020-09-13 23:56:09 rtt min/avg/max/mdev = 30.770/66.025/1518.730/97.601 ms

############## mia - 09/14/20 00:21:15 EST -0500 ##############

2020-09-14 12:01:44 700 packets transmitted, 699 received, 0% packet loss, time 41969283ms
2020-09-14 12:01:44 rtt min/avg/max/mdev = 29.888/54.730/2314.771/93.258 ms

############## mia - 09/14/20 12:15:44 EST -0500 ##############

2020-09-14 23:56:11 700 packets transmitted, 699 received, 0% packet loss, time 41966628ms
2020-09-14 23:56:11 rtt min/avg/max/mdev = 29.541/64.782/1321.056/82.876 ms

############## mia - 09/15/20 00:21:17 EST -0500 ##############

2020-09-15 12:01:43 700 packets transmitted, 696 received, 0% packet loss, time 41966457ms
2020-09-15 12:01:43 rtt min/avg/max/mdev = 28.746/90.094/1477.181/156.054 ms

############## mia - 09/16/20 00:21:16 EST -0500 ##############

2020-09-16 12:00:45 700 packets transmitted, 700 received, 0% packet loss, time 41968571ms
2020-09-16 12:00:45 rtt min/avg/max/mdev = 30.743/51.921/343.422/23.090 ms

############## mia - 09/16/20 12:15:40 EST -0500 ##############

2020-09-16 23:55:07 700 packets transmitted, 700 received, 0% packet loss, time 41967389ms
2020-09-16 23:55:07 rtt min/avg/max/mdev = 33.779/61.440/761.173/50.071 ms

############## mia - 09/17/20 00:21:19 EST -0500 ##############

2020-09-17 12:00:46 700 packets transmitted, 700 received, 0% packet loss, time 41967160ms
2020-09-17 12:00:46 rtt min/avg/max/mdev = 27.953/56.461/3665.632/144.881 ms

############## mia - 09/17/20 12:15:42 EST -0500 ##############

2020-09-17 23:56:11 700 packets transmitted, 699 received, 0% packet loss, time 41969361ms
2020-09-17 23:56:11 rtt min/avg/max/mdev = 34.079/55.306/252.807/15.808 ms

############## mia - 09/18/20 00:21:20 EST -0500 ##############

2020-09-18 12:00:45 700 packets transmitted, 700 received, 0% packet loss, time 41965233ms
2020-09-18 12:00:45 rtt min/avg/max/mdev = 28.556/47.177/209.529/14.366 ms

############## mia - 09/18/20 12:15:42 EST -0500 ##############

2020-09-18 23:56:08 700 packets transmitted, 699 received, 0% packet loss, time 41965426ms
2020-09-18 23:56:08 rtt min/avg/max/mdev = 29.095/55.855/1279.220/69.274 ms

############## mia - 09/19/20 00:21:18 EST -0500 ##############

2020-09-19 12:00:44 700 packets transmitted, 700 received, 0% packet loss, time 41966095ms
2020-09-19 12:00:44 rtt min/avg/max/mdev = 27.112/49.188/364.475/22.811 ms

############## mia - 09/19/20 12:15:43 EST -0500 ##############

2020-09-19 23:55:08 700 packets transmitted, 700 received, 0% packet loss, time 41964576ms
2020-09-19 23:55:08 rtt min/avg/max/mdev = 30.327/59.682/3695.904/170.476 ms

############## mia - 09/20/20 00:21:26 EST -0500 ##############

2020-09-20 12:00:52 700 packets transmitted, 700 received, 0% packet loss, time 41966168ms
2020-09-20 12:00:52 rtt min/avg/max/mdev = 27.069/52.044/1227.465/58.924 ms

############## mia - 09/20/20 12:15:42 EST -0500 ##############

2020-09-20 23:56:11 700 packets transmitted, 699 received, 0% packet loss, time 41969420ms
2020-09-20 23:56:11 rtt min/avg/max/mdev = 31.546/57.056/1404.992/67.746 ms

############## mia - 09/21/20 00:21:24 EST -0500 ##############

2020-09-21 12:01:48 700 packets transmitted, 698 received, 0% packet loss, time 41963837ms
2020-09-21 12:01:48 rtt min/avg/max/mdev = 28.914/57.251/1447.518/80.468 ms

############## mia - 09/21/20 12:15:43 EST -0500 ##############

2020-09-21 23:56:08 700 packets transmitted, 698 received, 0% packet loss, time 41965103ms
2020-09-21 23:56:08 rtt min/avg/max/mdev = 29.588/68.807/1898.623/114.672 ms

############## mia - 09/22/20 00:21:23 EST -0500 ##############

2020-09-22 12:01:50 700 packets transmitted, 699 received, 0% packet loss, time 41966702ms
2020-09-22 12:01:50 rtt min/avg/max/mdev = 26.470/55.866/2290.191/95.646 ms

############## mia - 09/22/20 12:15:41 EST -0500 ##############

2020-09-22 23:55:10 700 packets transmitted, 700 received, 0% packet loss, time 41968285ms
2020-09-22 23:55:10 rtt min/avg/max/mdev = 30.284/60.486/1123.621/51.330 ms

############## mia - 09/23/20 00:21:22 EST -0500 ##############

2020-09-23 12:00:50 700 packets transmitted, 700 received, 0% packet loss, time 41968219ms
2020-09-23 12:00:50 rtt min/avg/max/mdev = 29.158/52.020/761.913/34.168 ms

############## mia - 09/23/20 12:15:42 EST -0500 ##############

2020-09-23 23:55:12 700 packets transmitted, 700 received, 0% packet loss, time 41970111ms
2020-09-23 23:55:12 rtt min/avg/max/mdev = 30.488/57.508/704.862/41.575 ms

############## mia - 09/24/20 00:21:25 EST -0500 ##############

2020-09-24 12:00:53 700 packets transmitted, 700 received, 0% packet loss, time 41968370ms
2020-09-24 12:00:53 rtt min/avg/max/mdev = 28.415/50.507/1189.485/49.726 ms

############## mia - 09/24/20 12:15:41 EST -0500 ##############

2020-09-24 23:56:12 700 packets transmitted, 699 received, 0% packet loss, time 41970917ms
2020-09-24 23:56:12 rtt min/avg/max/mdev = 33.109/61.248/763.199/47.377 ms

############## mia - 09/25/20 00:21:26 EST -0500 ##############

2020-09-25 12:00:57 700 packets transmitted, 700 received, 0% packet loss, time 41970863ms
2020-09-25 12:00:57 rtt min/avg/max/mdev = 29.889/46.732/263.699/15.689 ms

############## mia - 09/26/20 12:15:42 EST -0500 ##############

2020-09-26 23:55:09 700 packets transmitted, 700 received, 0% packet loss, time 41966952ms
2020-09-26 23:55:09 rtt min/avg/max/mdev = 30.288/50.064/457.075/27.868 ms

############## mia - 09/27/20 00:21:28 EST -0500 ##############

2020-09-27 12:00:55 700 packets transmitted, 700 received, 0% packet loss, time 41967427ms
2020-09-27 12:00:55 rtt min/avg/max/mdev = 29.087/46.238/218.366/11.037 ms

############## mia - 09/27/20 12:15:41 EST -0500 ##############

2020-09-27 23:55:09 700 packets transmitted, 700 received, 0% packet loss, time 41967436ms
2020-09-27 23:55:09 rtt min/avg/max/mdev = 30.594/50.718/250.196/17.417 ms

############## mia - 09/28/20 00:21:29 EST -0500 ##############

2020-09-28 12:00:55 700 packets transmitted, 700 received, 0% packet loss, time 41966380ms
2020-09-28 12:00:55 rtt min/avg/max/mdev = 27.298/58.375/1285.900/88.699 ms

############## mia - 09/28/20 12:15:41 EST -0500 ##############

2020-09-28 23:55:09 700 packets transmitted, 700 received, 0% packet loss, time 41968412ms
2020-09-28 23:55:09 rtt min/avg/max/mdev = 32.270/57.610/921.974/40.506 ms

############## mia - 09/29/20 00:21:30 EST -0500 ##############

2020-09-29 12:00:55 700 packets transmitted, 700 received, 0% packet loss, time 41964968ms
2020-09-29 12:00:55 rtt min/avg/max/mdev = 28.510/53.152/1061.011/58.962 ms

############## mia - 09/29/20 12:15:42 EST -0500 ##############

2020-09-29 23:55:10 700 packets transmitted, 700 received, 0% packet loss, time 41968065ms
2020-09-29 23:55:10 rtt min/avg/max/mdev = 28.733/55.766/367.501/30.567 ms

############## mia - 09/30/20 00:21:30 EST -0500 ##############

2020-09-30 12:00:56 700 packets transmitted, 700 received, 0% packet loss, time 41965203ms
2020-09-30 12:00:56 rtt min/avg/max/mdev = 27.540/63.044/1512.084/133.634 ms

############## mia - 09/30/20 12:15:44 EST -0500 ##############

2020-09-30 23:55:10 700 packets transmitted, 700 received, 0% packet loss, time 41965149ms
2020-09-30 23:55:10 rtt min/avg/max/mdev = 31.901/54.026/1069.590/55.822 ms

############## mia - 10/01/20 00:21:29 EST -0500 ##############

2020-10-01 12:00:57 700 packets transmitted, 700 received, 0% packet loss, time 41967548ms
2020-10-01 12:00:57 rtt min/avg/max/mdev = 29.232/53.642/1163.852/49.951 ms

############## mia - 10/01/20 12:15:44 EST -0500 ##############

2020-10-01 23:55:09 700 packets transmitted, 700 received, 0% packet loss, time 41964830ms
2020-10-01 23:55:09 rtt min/avg/max/mdev = 30.377/53.050/244.300/15.506 ms

############## mia - 10/02/20 00:21:31 EST -0500 ##############

2020-10-02 12:00:58 700 packets transmitted, 700 received, 0% packet loss, time 41967092ms
2020-10-02 12:00:58 rtt min/avg/max/mdev = 26.079/48.195/169.282/12.663 ms

############## mia - 10/02/20 12:15:42 EST -0500 ##############

2020-10-02 23:55:10 700 packets transmitted, 700 received, 0% packet loss, time 41968052ms
2020-10-02 23:55:10 rtt min/avg/max/mdev = 38.080/73.008/4509.703/176.417 ms

############## mia - 10/03/20 00:21:32 EST -0500 ##############

2020-10-03 12:00:58 700 packets transmitted, 700 received, 0% packet loss, time 41965915ms
2020-10-03 12:00:58 rtt min/avg/max/mdev = 36.314/63.320/5097.883/192.475 ms

############## mia - 10/03/20 12:15:41 EST -0500 ##############

2020-10-03 23:55:10 700 packets transmitted, 700 received, 0% packet loss, time 41968548ms
2020-10-03 23:55:10 rtt min/avg/max/mdev = 35.665/61.494/827.921/36.544 ms

############## mia - 10/04/20 00:21:36 EST -0500 ##############

2020-10-04 12:09:01 --- 8.8.8.8 ping statistics ---
2020-10-04 12:09:01 700 packets transmitted, 0 received, +381 errors, 100% packet loss, time 42435254ms

############## mia - 10/04/20 12:17:18 EST -0500 ##############

2020-10-05 00:03:58 --- 8.8.8.8 ping statistics ---
2020-10-05 00:03:58 700 packets transmitted, 0 received, +416 errors, 100% packet loss, time 42389433ms

############## mia - 10/05/20 12:17:16 EST -0500 ##############

############## mia - 10/05/20 12:17:16 EST -0500 ##############


############## mia - 10/05/20 14:02:03 EST -0500 ##############

############## mia - 10/05/20 14:02:03 EST -0500 ##############


############## mia - 10/06/20 00:21:35 EST -0500 ##############

2020-10-06 12:02:07 700 packets transmitted, 689 received, 1% packet loss, time 41971616ms
2020-10-06 12:02:07 rtt min/avg/max/mdev = 35.154/55.721/460.539/24.836 ms

############## mia - 10/07/20 00:21:37 EST -0500 ##############

2020-10-07 12:01:07 700 packets transmitted, 700 received, 0% packet loss, time 41969392ms
2020-10-07 12:01:07 rtt min/avg/max/mdev = 38.416/58.332/182.295/12.928 ms

############## mia - 10/08/20 00:21:39 EST -0500 ##############

2020-10-08 12:01:06 700 packets transmitted, 700 received, 0% packet loss, time 41966699ms
2020-10-08 12:01:06 rtt min/avg/max/mdev = 38.681/57.998/431.050/20.142 ms

############## mia - 10/09/20 09:16:56 EST -0500 ##############

2020-10-09 20:59:14 700 packets transmitted, 594 received, 15% packet loss, time 42078075ms
2020-10-09 20:59:14 rtt min/avg/max/mdev = 35.785/118.665/4300.398/309.935 ms

############## mia - 10/10/20 00:21:41 EST -0500 ##############

2020-10-10 12:01:58 700 packets transmitted, 696 received, 0% packet loss, time 41956771ms
2020-10-10 12:01:58 rtt min/avg/max/mdev = 35.199/133.337/10346.359/470.368 ms

############## mia - 10/11/20 00:21:38 EST -0500 ##############

2020-10-11 12:00:55 700 packets transmitted, 700 received, 0% packet loss, time 41956610ms
2020-10-11 12:00:55 rtt min/avg/max/mdev = 33.967/59.789/800.689/66.947 ms

############## mia - 10/12/20 00:21:41 EST -0500 ##############

2020-10-12 12:00:59 700 packets transmitted, 700 received, 0% packet loss, time 41958203ms
2020-10-12 12:00:59 rtt min/avg/max/mdev = 35.129/59.116/1448.964/95.025 ms

############## mia - 10/13/20 00:21:44 EST -0500 ##############

2020-10-14 00:01:17 1420 packets transmitted, 1420 received, 0% packet loss, time 85173215ms
2020-10-14 00:01:17 rtt min/avg/max/mdev = 34.223/57.479/672.537/28.121 ms

############## mia - 10/15/20 00:21:42 EST -0500 ##############

2020-10-16 00:02:27 1420 packets transmitted, 1367 received, 3% packet loss, time 85184794ms
2020-10-16 00:02:27 rtt min/avg/max/mdev = 28.760/123.816/3079.891/252.599 ms

############## mia - 10/16/20 00:21:46 EST -0500 ##############

2020-10-17 00:02:23 1420 packets transmitted, 1417 received, 0% packet loss, time 85177348ms
2020-10-17 00:02:23 rtt min/avg/max/mdev = 29.569/79.045/2484.590/131.775 ms

############## mia - 10/17/20 00:21:44 EST -0500 ##############

2020-10-18 00:02:22 1420 packets transmitted, 1413 received, 0% packet loss, time 85177872ms
2020-10-18 00:02:22 rtt min/avg/max/mdev = 28.666/81.348/3434.459/169.589 ms

############## mia - 10/18/20 00:21:46 EST -0500 ##############

2020-10-19 00:02:28 1420 packets transmitted, 1404 received, 1% packet loss, time 85181895ms
2020-10-19 00:02:28 rtt min/avg/max/mdev = 28.843/118.165/3143.956/203.231 ms

############## mia - 10/23/20 00:21:56 EST -0500 ##############

2020-10-24 00:02:33 1420 packets transmitted, 1415 received, 0% packet loss, time 85177175ms
2020-10-24 00:02:33 rtt min/avg/max/mdev = 35.640/106.852/4861.631/218.206 ms

############## mia - 10/24/20 00:21:53 EST -0500 ##############

2020-10-25 00:02:32 1420 packets transmitted, 1419 received, 0% packet loss, time 85178702ms
2020-10-25 00:02:32 rtt min/avg/max/mdev = 32.022/72.727/1560.833/110.149 ms

############## mia - 10/25/20 00:21:55 EST -0500 ##############

2020-10-26 00:01:36 1420 packets transmitted, 1420 received, 0% packet loss, time 85180893ms
2020-10-26 00:01:36 rtt min/avg/max/mdev = 29.756/87.759/1344.037/85.537 ms

############## mia - 10/26/20 00:21:57 EST -0500 ##############

2020-10-27 00:02:56 1420 packets transmitted, 1412 received, 0% packet loss, time 85199547ms
2020-10-27 00:02:56 rtt min/avg/max/mdev = 35.059/101.829/2799.283/200.270 ms

############## mia - 10/27/20 00:22:01 EST -0500 ##############

2020-10-28 00:01:38 1420 packets transmitted, 1420 received, 0% packet loss, time 85176631ms
2020-10-28 00:01:38 rtt min/avg/max/mdev = 34.039/65.550/485.221/33.942 ms

############## mia - 10/28/20 00:21:59 EST -0500 ##############

2020-10-29 00:02:44 1420 packets transmitted, 1398 received, 1% packet loss, time 85185796ms
2020-10-29 00:02:44 rtt min/avg/max/mdev = 32.961/118.002/3158.699/235.970 ms

############## mia - 10/29/20 00:21:57 EST -0500 ##############

2020-10-30 00:02:33 1420 packets transmitted, 1419 received, 0% packet loss, time 85176346ms
2020-10-30 00:02:33 rtt min/avg/max/mdev = 31.981/65.453/1119.066/40.653 ms

############## mia - 10/30/20 00:21:59 EST -0500 ##############

2020-10-31 00:02:39 1420 packets transmitted, 1419 received, 0% packet loss, time 85179643ms
2020-10-31 00:02:39 rtt min/avg/max/mdev = 32.071/61.251/2331.989/93.146 ms

############## mia - 10/31/20 00:22:06 EST -0500 ##############

2020-11-01 00:02:46 1420 packets transmitted, 1419 received, 0% packet loss, time 85179871ms
2020-11-01 00:02:46 rtt min/avg/max/mdev = 34.836/72.262/1255.089/76.248 ms

############## mia - 11/01/20 00:22:01 EST -0500 ##############

2020-11-02 00:01:40 1420 packets transmitted, 1420 received, 0% packet loss, time 85178745ms
2020-11-02 00:01:40 rtt min/avg/max/mdev = 29.294/54.041/1132.792/37.426 ms

############## mia - 11/02/20 00:22:04 EST -0500 ##############

2020-11-03 00:02:44 1420 packets transmitted, 1418 received, 0% packet loss, time 85179612ms
2020-11-03 00:02:44 rtt min/avg/max/mdev = 30.502/65.956/1520.847/81.557 ms

############## mia - 11/03/20 00:22:07 EST -0500 ##############

2020-11-04 00:02:42 1420 packets transmitted, 1419 received, 0% packet loss, time 85175443ms
2020-11-04 00:02:42 rtt min/avg/max/mdev = 29.425/62.241/930.005/45.936 ms

############## mia - 11/04/20 00:22:09 EST -0500 ##############

2020-11-05 00:02:51 1420 packets transmitted, 1417 received, 0% packet loss, time 85182448ms
2020-11-05 00:02:51 rtt min/avg/max/mdev = 28.609/59.073/1185.365/54.048 ms

############## mia - 11/05/20 00:22:06 EST -0500 ##############

2020-11-06 00:02:41 1420 packets transmitted, 1417 received, 0% packet loss, time 85174957ms
2020-11-06 00:02:41 rtt min/avg/max/mdev = 29.088/56.711/1292.971/48.761 ms

############## mia - 11/06/20 00:22:08 EST -0500 ##############

2020-11-07 00:01:43 1420 packets transmitted, 1420 received, 0% packet loss, time 85175271ms
2020-11-07 00:01:43 rtt min/avg/max/mdev = 31.715/62.392/3421.663/113.312 ms

############## mia - 11/07/20 00:22:15 EST -0500 ##############

2020-11-08 00:02:56 1420 packets transmitted, 1419 received, 0% packet loss, time 85181093ms
2020-11-08 00:02:56 rtt min/avg/max/mdev = 29.338/58.610/689.541/32.314 ms

############## mia - 11/08/20 00:22:13 EST -0500 ##############

2020-11-09 00:01:54 1420 packets transmitted, 1420 received, 0% packet loss, time 85181077ms
2020-11-09 00:01:54 rtt min/avg/max/mdev = 31.040/60.768/889.236/37.298 ms

############## mia - 11/09/20 00:22:16 EST -0500 ##############

2020-11-10 00:02:50 1420 packets transmitted, 1415 received, 0% packet loss, time 85174361ms
2020-11-10 00:02:50 rtt min/avg/max/mdev = 32.058/84.777/4259.956/178.360 ms

############## mia - 11/10/20 00:22:11 EST -0500 ##############

2020-11-11 00:02:48 1420 packets transmitted, 1419 received, 0% packet loss, time 85177064ms
2020-11-11 00:02:48 rtt min/avg/max/mdev = 32.121/64.335/1134.668/54.631 ms

############## mia - 11/11/20 00:22:12 EST -0500 ##############

2020-11-12 00:02:47 1420 packets transmitted, 1417 received, 0% packet loss, time 85174779ms
2020-11-12 00:02:47 rtt min/avg/max/mdev = 28.830/61.212/1256.812/54.917 ms

############## mia - 11/12/20 00:22:14 EST -0500 ##############

2020-11-13 00:01:49 1420 packets transmitted, 1420 received, 0% packet loss, time 85174959ms
2020-11-13 00:01:49 rtt min/avg/max/mdev = 31.780/61.431/1777.057/59.146 ms

############## mia - 11/13/20 00:22:16 EST -0500 ##############

2020-11-14 00:01:54 1420 packets transmitted, 1420 received, 0% packet loss, time 85177641ms
2020-11-14 00:01:54 rtt min/avg/max/mdev = 31.971/60.296/525.264/29.916 ms

############## mia - 11/14/20 00:22:22 EST -0500 ##############

2020-11-15 00:02:00 1420 packets transmitted, 1420 received, 0% packet loss, time 85178576ms
2020-11-15 00:02:00 rtt min/avg/max/mdev = 31.827/64.535/1735.426/66.955 ms

############## mia - 11/15/20 00:22:15 EST -0500 ##############

2020-11-16 00:01:55 1420 packets transmitted, 1420 received, 0% packet loss, time 85179140ms
2020-11-16 00:01:55 rtt min/avg/max/mdev = 29.636/65.533/1884.642/75.292 ms

############## mia - 11/16/20 00:22:19 EST -0500 ##############

2020-11-17 00:01:53 1420 packets transmitted, 1420 received, 0% packet loss, time 85174436ms
2020-11-17 00:01:53 rtt min/avg/max/mdev = 27.648/62.099/480.567/34.363 ms

############## mia - 11/17/20 00:22:24 EST -0500 ##############

2020-11-18 00:01:59 1420 packets transmitted, 1420 received, 0% packet loss, time 85174359ms
2020-11-18 00:01:59 rtt min/avg/max/mdev = 33.049/62.519/491.671/31.388 ms

############## mia - 11/18/20 00:22:22 EST -0500 ##############

2020-11-19 00:03:00 1420 packets transmitted, 1418 received, 0% packet loss, time 85177988ms
2020-11-19 00:03:00 rtt min/avg/max/mdev = 31.742/79.820/2609.352/86.855 ms

############## mia - 11/19/20 00:22:27 EST -0500 ##############

2020-11-20 00:03:04 1420 packets transmitted, 1419 received, 0% packet loss, time 85177645ms
2020-11-20 00:03:04 rtt min/avg/max/mdev = 28.310/61.803/1867.281/66.397 ms

############## mia - 11/20/20 00:22:22 EST -0500 ##############

2020-11-21 00:03:01 1420 packets transmitted, 1416 received, 0% packet loss, time 85178418ms
2020-11-21 00:03:01 rtt min/avg/max/mdev = 29.395/58.477/1374.469/44.010 ms

############## mia - 11/21/20 00:22:23 EST -0500 ##############

2020-11-22 00:03:02 1420 packets transmitted, 1419 received, 0% packet loss, time 85178635ms
2020-11-22 00:03:02 rtt min/avg/max/mdev = 34.188/59.320/475.783/25.654 ms

############## mia - 11/22/20 00:22:28 EST -0500 ##############

2020-11-23 00:03:09 1420 packets transmitted, 1419 received, 0% packet loss, time 85180250ms
2020-11-23 00:03:09 rtt min/avg/max/mdev = 32.862/58.254/526.665/28.035 ms

############## mia - 11/23/20 00:22:26 EST -0500 ##############

2020-11-24 00:03:04 1420 packets transmitted, 1416 received, 0% packet loss, time 85177662ms
2020-11-24 00:03:04 rtt min/avg/max/mdev = 31.447/63.838/2000.445/74.720 ms

############## mia - 11/25/20 00:22:30 EST -0500 ##############

2020-11-26 00:03:06 1420 packets transmitted, 1418 received, 0% packet loss, time 85175694ms
2020-11-26 00:03:06 rtt min/avg/max/mdev = 32.713/56.847/1339.746/45.239 ms

############## mia - 11/26/20 00:22:30 EST -0500 ##############

2020-11-27 00:02:06 1420 packets transmitted, 1420 received, 0% packet loss, time 85175864ms
2020-11-27 00:02:06 rtt min/avg/max/mdev = 33.770/71.775/721.262/50.298 ms

############## mia - 11/27/20 00:22:31 EST -0500 ##############

2020-11-28 00:03:07 1420 packets transmitted, 1418 received, 0% packet loss, time 85176565ms
2020-11-28 00:03:07 rtt min/avg/max/mdev = 32.472/60.481/580.157/34.088 ms

############## mia - 11/28/20 00:22:35 EST -0500 ##############

2020-11-29 00:03:16 1420 packets transmitted, 1419 received, 0% packet loss, time 85180601ms
2020-11-29 00:03:16 rtt min/avg/max/mdev = 33.069/57.157/551.924/27.700 ms

############## mia - 11/29/20 00:22:35 EST -0500 ##############

2020-11-30 00:02:13 1420 packets transmitted, 1420 received, 0% packet loss, time 85178223ms
2020-11-30 00:02:13 rtt min/avg/max/mdev = 32.380/60.322/848.702/35.880 ms

############## mia - 11/30/20 00:22:33 EST -0500 ##############

2020-12-01 00:03:14 1420 packets transmitted, 1417 received, 0% packet loss, time 85181276ms
2020-12-01 00:03:14 rtt min/avg/max/mdev = 33.019/58.438/465.097/25.375 ms

############## mia - 12/01/20 00:22:37 EST -0500 ##############

2020-12-02 00:03:13 1420 packets transmitted, 1419 received, 0% packet loss, time 85175464ms
2020-12-02 00:03:13 rtt min/avg/max/mdev = 33.795/62.638/500.249/31.655 ms

############## mia - 12/02/20 14:40:42 EST -0500 ##############

############## mia - 12/02/20 14:40:42 EST -0500 ##############


############## mia - 12/03/20 00:22:40 EST -0500 ##############

2020-12-04 00:03:20 1420 packets transmitted, 1419 received, 0% packet loss, time 85180647ms
2020-12-04 00:03:20 rtt min/avg/max/mdev = 37.209/68.524/446.428/37.324 ms

############## mia - 12/05/20 00:22:39 EST -0500 ##############

2020-12-06 00:02:18 1420 packets transmitted, 1420 received, 0% packet loss, time 85178279ms
2020-12-06 00:02:18 rtt min/avg/max/mdev = 30.601/61.709/1354.084/58.407 ms

############## mia - 12/07/20 00:22:44 EST -0500 ##############

############## mia - 12/07/20 00:22:44 EST -0500 ##############


############## mia - 12/08/20 00:22:48 EST -0500 ##############

############## mia - 12/08/20 00:22:48 EST -0500 ##############


############## mia - 12/09/20 00:22:48 EST -0500 ##############

############## mia - 12/09/20 00:22:48 EST -0500 ##############


############## mia - 12/10/20 00:22:54 EST -0500 ##############

############## mia - 12/10/20 00:22:54 EST -0500 ##############

